Rank,Name,Employee Count,Twitter,Potential Partner,Services,Website,LinkedIn,CRN Page
449,CentraComm,50,https://twitter.com/Centracomm,,"Managed IT Security, Managed Services, Woman Owned Business, Cloud Security, Server Management, Secure Access, IDP/IPS, SIEM, SSL/VPN, Data Centers, Firewall, Router, Switch Managment, KnowBe4, Juniper Networks, Zscaler, Endpoint Security, Riverbed, Palo Alto Networks, and WBENC",http://www.centracomm.net/,https://www.linkedin.com/company/centracomm/,http://www.crn.com/sp-500/2017/sp2017-details.htm?c=449
450,Converged Technology Group,41,https://twitter.com/ConvergedNY,,"Advanced Network Architecture, Unified Communications, Assist360 Ongoing Co-Managed Support Services, Advanced Wireless, Advanced Security, Data Center Virtualization, Desktop Virtualization, Staff Augmentation, Disaster Recovery, and Cloud Computing",http://www.convergedtechgroup.com/,http://www.linkedin.com/company/373805,http://www.crn.com/sp-500/2017/sp2017-details.htm?c=450
451,IP Pathways,54,https://twitter.com/IPPathways,,"Converged Infrastructure (vBlock and FlexPod), Data Center, Virtualization, Cloud, Wired and Wireless Networking, Managed Services, EMC, NetApp, Cisco, Meraki, VCE, VMware, Sophos, Unitrends, Kemp, Veeam, Brocade, Aruba, Scalable, Automated, Private Cloud, Hyper Converged, and Agile",http://www.ippathways.com/,http://www.linkedin.com/company/ip-pathways,http://www.crn.com/sp-500/2017/sp2017-details.htm?c=451
454,Concept Plus,80,https://twitter.com/conceptplusllc,,"Oracle E-Business Suite, Oracle Fusion Middleware, Cloud Computing, Oracle Database Management, Mobile Development, and Healthcare Integration",http://conceptplusllc.com,https://www.linkedin.com/company-beta/685175/,http://www.crn.com/sp-500/2017/sp2017-details.htm?c=454
457,Davenport Group,51,https://twitter.com/DavenportGroup,,"Data storage, Dell Compellent, Customer care, KACE, AppAssure, EqualLogic, Distaster recovery, Technical support, VMware, and Force10",http://www.davenportgroup.com,https://www.linkedin.com/company/davenport-group,http://www.crn.com/sp-500/2017/sp2017-details.htm?c=457
458,Transbeam,65,https://twitter.com/transbeam,,"Ethernet over Copper (EoC), Fiber, MPLS, 4G/LTE Wireless Backup, Hosted PBX, SIP Trunking, PRI, Network Monitoring, Professional IT Services, Cloud Solutions, Event Connectivity -- Wired & WIreless for large venues, conferences, meeting space, and Fixed Wireless",http://www.transbeam.com,http://www.linkedin.com/company/transbeam,http://www.crn.com/sp-500/2017/sp2017-details.htm?c=458
460,Chickasaw Telecom,46,https://twitter.com/chickasawtel,,"Cisco, NEC, Zultys, Security, Wireless, IPT, Video, Cameras, Telephony, Collaboration, WebEx, Juniper, and Pure Storage",http://chickasawtel.com/,https://www.linkedin.com/company/chickasaw-telecom-inc./,http://www.crn.com/sp-500/2017/sp2017-details.htm?c=460
461,Enterprise Computing Solutions (ECS),26,NA,,Business IT Professional Consultants and Hewlett Packard Enterprise Elite Partner,http://www.thinkecs.com/,http://www.linkedin.com/company/enterprise-computing-solutions,http://www.crn.com/sp-500/2017/sp2017-details.htm?c=461
462,Strategic Mobility Group (SMG3),29,https://twitter.com/SMobility3,,"Enterprise Mobility Solutions, Automatic ID and Data Capture, Value Added Reseller, Device Configuration and Training, Integrated System Consulting, RF Site Optimizations, Custom Application Development, Managed Support Services, and Wireless Infrastructure Planning",http://www.strategicmobility.com/,http://www.linkedin.com/company/strategic-mobility-group,http://www.crn.com/sp-500/2017/sp2017-details.htm?c=462
463,Trivalent Group,78,https://twitter.com/TrivalentGroup,,"Information Technology, Security, Internet Service Provider, Hosting, Data Center, Co-Location, Managed Networks, Disaster Recovery, Business Continuity, Storage, Systems Solutions, Help Desk, Managed Services Provider, Cloud Storage, and Virtualization",http://www.trivalentgroup.com/,http://www.linkedin.com/company/trivalent-group,http://www.crn.com/sp-500/2017/sp2017-details.htm?c=463
465,Lincoln Computer Services,51,https://twitter.com/Lincoln_CompSvs,,"Technology Solutions, Cloud Computing, Professional IT Services, Managed Services, IT Support, IT Consulting, IT Staffing, Disaster Recovery and Business Continuity, Virtualization, IT Infrastructure, IT Project Management, Help Desk, and Data Center",http://www.lincolnit.com,https://www.linkedin.com/company/lincoln-computer-services,http://www.crn.com/sp-500/2017/sp2017-details.htm?c=465
466,Stele Infotech,13,NA,,"Talent Acquisition, Technology Acquisition, Infrastructure Services, and Managed Services",http://www.steleinfotech.com/,https://www.linkedin.com/company/stele-infotech/,http://www.crn.com/sp-500/2017/sp2017-details.htm?c=466
467,ZeroLag,46,https://twitter.com/ZeroLagHosting,,"Managed Hosting, Cloud Services, Virtual Private Servers, Email Hosting, Exchange Hosting, and Web Hosting",http://www.zerolag.com/,https://www.linkedin.com/company/zerolag-hosting,http://www.crn.com/sp-500/2017/sp2017-details.htm?c=467
468,Compudyne,85,https://twitter.com/compudyne,,"Managed Services, IT and Network Infrastructure, Cloud Building, Data Center, Hosted Services, Internet and Transport, Hardware/Software Procurement, and Green IT",http://www.compudyne.net,https://www.linkedin.com/company/compudyne-inc/,http://www.crn.com/sp-500/2017/sp2017-details.htm?c=468
469,Greyson Technologies,29,https://twitter.com/greysontech,,"Unified Communications and Mobility, Data Center and Security, Virtualization, and Managed Services and Assessments",http://www.greyson.com,http://www.linkedin.com/company/greyson-technologies-inc-/,http://www.crn.com/sp-500/2017/sp2017-details.htm?c=469
470,iland,98,https://twitter.com/ilandcloud,,"public cloud hosting, private cloud, disaster recovery, business continuity, DRaaS, IaaS, VMware, Cisco Cloud, Cloud Hosting, Zerto, Veeam, Cloud Backup, BaaS, and Cisco",http://www.iland.com/,https://www.linkedin.com/company/203905,http://www.crn.com/sp-500/2017/sp2017-details.htm?c=470
471,Candoris Technologies,56,https://twitter.com/candoristech,,"Data Center Solutions, IT Service, Application Development, Salesforce.com Consulting, Data Center Solutions, Staff Augmentation, Microsoft Services, Virtualization, and Networking",http://www.candoris.com,https://www.linkedin.com/company/candoris-technologies,http://www.crn.com/sp-500/2017/sp2017-details.htm?c=471
475,Glowpoint,87,https://twitter.com/GlowpointBuzz,,"Video Collaboration Services, Network Services for Videoconferencing, Business-class Support Services, Webcast Production & Broadcasting, Managed Videoconferencing, Cloud Services for Video Collaboration, Video Meeting Suites, and Unified Communications",http://www.glowpoint.com/,https://www.linkedin.com/company/glowpoint-inc,http://www.crn.com/sp-500/2017/sp2017-details.htm?c=475
476,Coretelligent,76,https://twitter.com/coretelligent,,"Complete IT support, customized IT roadmaps, private cloud hosting, best-of-breed technology solutions, security & data protection, backup & disaster recovery, onsite & remote support, project management, white glove customer service, and discounted procurement",http://www.coretelligent.com,http://www.linkedin.com/company/coretelligent,http://www.crn.com/sp-500/2017/sp2017-details.htm?c=476
478,Peak UpTime,58,https://twitter.com/PeakUpTime,,"Cloud Services, Managed Services, Unified Communications, Networking, and Security",http://www.peakuptime.com/,https://www.linkedin.com/company/peak-uptime,http://www.crn.com/sp-500/2017/sp2017-details.htm?c=478
479,Edge Hosting,58,https://twitter.com/edgewebhosting,,"High Availability Hosting, FedRAMP, PCI, HIPAA, SSAE16 Compliance, Managed Hosting Services, Public, Private, Hybrid Cloud Hosting, ColdFusion, Content Delivery Network Hosting, Managed Services for AWS, Cloud Design, Cloud Migration, and Colocation",http://www.edgehosting.com,https://www.linkedin.com/company/edge-hosting-llc,http://www.crn.com/sp-500/2017/sp2017-details.htm?c=479
480,Relus Technologies,64,https://twitter.com/RelusTech,,"Enterprise Cloud Solutions, Pre-Owned & New Surplus Hardware, IT Staffing, Recruiting & Training, and Hardware Maintenance Solutions",http://www.relus.com,https://www.linkedin.com/company/relus-technologies,http://www.crn.com/sp-500/2017/sp2017-details.htm?c=480
481,Interactive Digital Solutions,83,https://twitter.com/IDSolutionsInc,,,http://www.e-idsolutions.com,https://www.linkedin.com/company/idsolutions,http://www.crn.com/sp-500/2017/sp2017-details.htm?c=481
483,Network Solutions Provider (NSP),4,https://twitter.com/NSPTeclo,,"telecommunications, It Security, software, unified communications, Colocation, It consulting, VOIP, Wireless, Managed Service Provider, IT Expense Management, Networking consulting, Cloud, IOT, Gigabit ethernet, IT Staffing, Elte, Flash storage, Data Center, and cybersecurity",http://www.networksolutionsprovider.com/,https://www.linkedin.com/company/2409011/,http://www.crn.com/sp-500/2017/sp2017-details.htm?c=483
484,Mosaic Technology,55,https://twitter.com/MosaicTec,,"Asset Recovery/Disposition, Disaster Recovery Services, Enterprise Storage, Maintenance, Rentals, Servers, Virtualization, and HP Renew",http://www.mosaictec.com/,http://www.linkedin.com/company/mosaic-technology?trk=fc_badge,http://www.crn.com/sp-500/2017/sp2017-details.htm?c=484
485,Pegasus Technology Solutions,18,https://twitter.com/Pegasus__Tech,,"Professional Services, Managed Services, IT Inventory and Contract Management, and IT Staffing",http://www.pegasustechsolutions.com,https://www.linkedin.com/company/pegasus-technology-solutions-llc,http://www.crn.com/sp-500/2017/sp2017-details.htm?c=485
487,JMARK Business Solutions,95,https://twitter.com/JMARK_Support,,,http://www.jmark.com,https://www.linkedin.com/company/jmark-business-solutions-inc-,http://www.crn.com/sp-500/2017/sp2017-details.htm?c=487
488,Quality Uptime Services,46,NA,,,http://www.qualityuptime.com,https://www.linkedin.com/company/quality-uptime-services,http://www.crn.com/sp-500/2017/sp2017-details.htm?c=488
489,Transformyx,48,https://twitter.com/transformyx,,,http://www.tfmx.com,https://www.linkedin.com/company/transformyx,http://www.crn.com/sp-500/2017/sp2017-details.htm?c=489
492,JDL Technologies,51,https://twitter.com/jdltechnologies,,,http://www.jdltech.com/,https://www.linkedin.com/company/59636/,http://www.crn.com/sp-500/2017/sp2017-details.htm?c=492
493,Global Technology Solutions Group (GTSG),50,https://twitter.com/GTSGServices,,,http://www.gtsg.com/,https://www.linkedin.com/company/global-technology-solutions-group---gtsg/,http://www.crn.com/sp-500/2017/sp2017-details.htm?c=493
494,Agosto,87,https://twitter.com/goagosto,,,http://www.agosto.com,https://www.linkedin.com/company/agosto/,http://www.crn.com/sp-500/2017/sp2017-details.htm?c=494
496,iCorps Technologies,76,https://twitter.com/iCorps_Tech,,,http://www.icorps.com,https://www.linkedin.com/company/icorps-technologies,http://www.crn.com/sp-500/2017/sp2017-details.htm?c=496
497,InCare Technologies,45,https://twitter.com/InCareTech,,,http://incaretechnologies.com/,https://www.linkedin.com/company/incare-technologies/,http://www.crn.com/sp-500/2017/sp2017-details.htm?c=497
498,ClearObject,35,https://twitter.com/ClearObject,,,http://www.clearobject.com,https://www.linkedin.com/company/clearobject,http://www.crn.com/sp-500/2017/sp2017-details.htm?c=498
500,designDATA,78,https://twitter.com/desdat,,,http://www.designdata.com,http://www.linkedin.com/company/designdata,http://www.crn.com/sp-500/2017/sp2017-details.htm?c=500500,designDATA,78,https://twitter.com/desdat,,"IT Consulting, Outsourcing, Assessments, and Data Center Services",http://www.designdata.com,http://www.linkedin.com/company/designdata,http://www.crn.com/sp-500/2017/sp2017-details.htm?c=500
