Rank,Name,Employee Count,Twitter,Potential Partner,Services,Website,LinkedIn,CRN Page
69,ThunderCat Technology,52,https://twitter.com/ThunderCat_Tech,,"Systems Integrator, IT Solutions and Services, Data Storage, Networking, Applications, Cyber Security, and Big Data",http://www.thundercattech.com/,http://www.linkedin.com/company/thundercat-technology,http://www.crn.com/sp-500/2017/sp2017-details.htm?c=69
103,Blue Tech,45,https://twitter.com/BlueTechInc,,NA,http://www.bluetech.com/,https://www.linkedin.com/company/blue-tech/,http://www.crn.com/sp-500/2017/sp2017-details.htm?c=103
198,CANCOM HPM Networks,88,https://twitter.com/HPMnetworks,,"HP, Blades, BladeSystem, VMware, Networking, Services, Storage, Spares Management (Spares Locker), Virtualization, Security, Cloud Computing, Citrix, Desktop Virtualization, OpenStack, SAN, and Hyperscale / Web 2.0",http://www.hpmnetworks.com/,https://www.linkedin.com/company/82248/,http://www.crn.com/sp-500/2017/sp2017-details.htm?c=198
109,IIS Technology,79,https://twitter.com/IISTech,,"Project Management, Converged Infrastructure, Cloud Systems (Private and Hybrid), Storage Architecture & Data Protection, Data Center Operations & Automation, Data Center Services, Systems Integration, and Enterprise Application Infrastructure",http://www.iisl.com/,http://www.linkedin.com/company/434478?trk=tyah,http://www.crn.com/sp-500/2017/sp2017-details.htm?c=109
111,Worldcom Exchange (WEI),91,https://twitter.com/wei_com,,"Server / Storage Solutions, Cloud & Virtualization, Networking & Security, Technology Solution and Service Provider, Big Data Infrastructure, and Mobility & End User Computing",http://www.wei.com/,https://www.linkedin.com/company/635601,http://www.crn.com/sp-500/2017/sp2017-details.htm?c=111
125,Dynamix,77,https://twitter.com/Dynamix_Mix,1,"IT Solutions, Storage, Data Center Infrastructure, Networking, Data Protectoin, IT Maintenance, IT Security, and Technical Advisory",http://www.dynamixgroup.com/,https://www.linkedin.com/company/dynamix-group,http://www.crn.com/sp-500/2017/sp2017-details.htm?c=125
128,Advanced Computer Concepts (ACC),65,NA,,"IT Products and Services, IT Security Solutions, Audio Visual Solutions, Cisco, HP, Lenovo, SMART Technology, Dell, RSA, Palo Alto Networks, Checkpoint, Crestron, VMWare, and RedHat",http://www.acc.net/,https://www.linkedin.com/company/advanced-computer-concepts/,http://www.crn.com/sp-500/2017/sp2017-details.htm?c=128
141,Copper River IT,99,https://twitter.com/CopperRiverIT,,"Cyber Security, Virtualization, Cloud, Data Center, Enterprise Wireless Networks, Acquisition Support, Data Center & Cloud, Testing & Troubleshooting, Help Desk, Admin Support, and Program Management",http://www.copperriverit.com/,https://www.linkedin.com/company/334481?trk=tyah,http://www.crn.com/sp-500/2017/sp2017-details.htm?c=141
142,Mercom Corporation,90,https://twitter.com/mercomcorp,1,"""We Innovate Government""​, Solutions Provider, and IT Products and Services",http://www.mercomcorp.com/,https://www.linkedin.com/company/145728/,http://www.crn.com/sp-500/2017/sp2017-details.htm?c=142
148,Lumenate,55,https://twitter.com/Lumenate,1,"Storage & Virtualization, Security & Compliance, Networking & Collaboration, and Cloud & Connectivity",http://www.lumenate.com/,https://www.linkedin.com/company/lumenate/,http://www.crn.com/sp-500/2017/sp2017-details.htm?c=148
163,Dasher Technologies,73,https://twitter.com/dashertech,1,"High Performance Computing, Open Source Linux, EDA, Data Center, Reseller, State and Local Government, High Education, DCC, IT Solutions, Cyber Security, Cloud, Big Data, Services, Networking, Software, Storage, Converged, HPE Partner, IT Support Renewal, Hybrid IT, SLED, System Integration, DellEMC Partner, and Cisco Partner",http://www.dasher.com/,http://www.linkedin.com/company/142802,http://www.crn.com/sp-500/2017/sp2017-details.htm?c=163
165,FlexITy Solutions,99,https://twitter.com/goFlexITy,1,"service provider, storage, Cisco, network operations, voice & data services, technical assistance, unified communications, ITIL, Microsoft, VMware, disaster recovery, testing, Oracle, integration, CLEC, project governance, CRTC, secure telecom, IT solutions, and managed services",http://www.flexity.ca/,http://www.linkedin.com/company/flexity-solutions-inc.,http://www.crn.com/sp-500/2017/sp2017-details.htm?c=165
167,DKW Communications,97,https://twitter.com/DKW_CommInc,1,"Applications Development, Software and Systems Engineering, Information Management, and Facilities and Administrative Services",http://www.dkwcommunications.com/,https://www.linkedin.com/company/dkw-communications-inc-/,http://www.crn.com/sp-500/2017/sp2017-details.htm?c=365
168,Evolving Solutions,81,https://twitter.com/EvolvingSol,1,"Server and Storage Virtualization, Server and Storage Consolidation, Business Continuity, Disaster Recovery planning, Green IT, and Cloud Computing",http://www.evolvingsol.com/,https://www.linkedin.com/company/evolving-solutions,http://www.crn.com/sp-500/2017/sp2017-details.htm?c=168
175,"Integrated Data Storage, LLC",27,https://twitter.com/IDSforward,1,"data storage, managed services, cloud services, information technology, deduplication, virtualization, replication, backup, disaster recovery, san, nas, emc, commvault, data domain, vmware, symantec, Cleversafe, VMware, cisco, and cisco ucs",http://www.idsforward.com/,https://www.linkedin.com/company/83045?trk=tyah&trkInfo=clickedVertical%3Acompany%2Cidx%3A1-1-1%2CtarId%3A1433858506756%2Ctas%3AIDS%20-%20IT%20Solution,http://www.crn.com/sp-500/2017/sp2017-details.htm?c=175
177,eGroup,97,https://twitter.com/eGroup_Inc,,"Sales Promotions, Loyalty Programs, Event & Promotional Merchandise, Motorsports Marketing, Email & Social Media Marketing, Website Development, Fulfillment & Warehouse Services, Online Company Stores & Training, Design & Production, and Print-on-Demand Solutions",http://www.egroup-us.com/,https://www.linkedin.com/company/1887697/,http://www.crn.com/sp-500/2017/sp2017-details.htm?c=423
185,Advanced Systems Group (ASG),84,https://twitter.com/Virtual_com,,"Enterprise Storage, Data Center Optimization, Virtualization, DR/BC, Cloud Computing, Networking, and Data Security",http://www.virtual.com/,https://www.linkedin.com/company/advancedsystemsgroup,http://www.crn.com/sp-500/2017/sp2017-details.htm?c=185
187,Golden Star Technology (GST),84,NA,,"Technology Consulting, Managed Services, Infrastructure Integration and Services, Sourcing and Fulfillment, Audio Visual Solutions, IT Consulting, Networking, and Security",http://www.gstes.com/,https://www.linkedin.com/company/golden-star-technology-gst/,http://www.crn.com/sp-500/2017/sp2017-details.htm?c=187
191,SKC Communications,13,https://twitter.com/SKCComm,,NA,http://www.skccom.com/,http://www.linkedin.com/company/skc,http://www.crn.com/sp-500/2017/sp2017-details.htm?c=191
195,Bedrock Technology Partners,18,https://twitter.com/BedrockTech,,"IT Solutions Architecture, IT Consulting, IT Sales, Cloud, Security, DevOps, Storage, Networking, Software Defined IT, Virtualization, and Route/Switch",http://www.bedrock-tech.com/,https://www.linkedin.com/company/bedrock-technology-partners/,http://www.crn.com/sp-500/2017/sp2017-details.htm?c=195
206,PCPC Direct,76,https://twitter.com/PCPCDirect,,"Managed Services, Virtualization, Networking Architecture, Security, Storage Solutions, Data Protection, Servers, and High Performance Computing",http://www.pcpcdirect.com/,https://www.linkedin.com/company/pcpc-direct-ltd-/,http://www.crn.com/sp-500/2017/sp2017-details.htm?c=206
212,Strategic Communications,45,https://twitter.com/YourStrategic,,"Technology Solutions, Network & Structured Cabling, Voice & Data Network, Wireless Network, Audio/Video Solutions, Video conferencing Solutions, Computer Equipment & Maintenance, IT Equipment & Maintenance, Cloud Services, and Unified Communications and Collaboration",http://www.yourstrategic.com/,https://www.linkedin.com/company-beta/2879049/,http://www.crn.com/sp-500/2017/sp2017-details.htm?c=212
214,Internetwork Engineering (IE),78,https://twitter.com/ineteng,,"Collaboration Technologies, Network Security & Compliance, Data Storage, Converged & Hyper-Converged Infrastructure, Cloud Storage & Computing, Intelligent Networks, Mobile Device Management, Consulting & Implementation Services, and Elastic Engineering Services",http://www.ineteng.com/,https://www.linkedin.com/company/internetwork-engineering,http://www.crn.com/sp-500/2017/sp2017-details.htm?c=214
215,Nexum,95,https://twitter.com/NexumInc,,"Network Security Products, Professional Services, Managed Security Services, Support, and Training",http://www.nexuminc.com/,http://www.linkedin.com/company/nexum-inc,http://www.crn.com/sp-500/2017/sp2017-details.htm?c=215
216,Paragon Micro,85,NA,,"Security and Risk Mitigation, Big Data, Virtualization, Storage, Managed and Professional Services, and Technology Procurement",http://www.paragonmicro.com/,http://www.linkedin.com/company/paragon-micro,http://www.crn.com/sp-500/2017/sp2017-details.htm?c=216
218,PCi Tec,8,https://twitter.com/TecPCi,,"Cybersecurity Services, Managed Deployment Services, Professional Services, IT Hardware, IT Software, IT Peripherals, Advanced Threat Hunting, Endpoint Protection, Privileged Access Management, NGFW, Identity Management (ICAM/PAM), Compromise Assessments, Encryption, Security Information and Event Management (SIEM) Tools, Data Forensics, Intrusion Detection and Prevention Systems (IDS and IPS), Remediation, Advanced Firewalls, Insider Threat Protection, and Application Development Security",http://www.pcitec.com/,https://www.linkedin.com/company-beta/24792692/,http://www.crn.com/sp-500/2017/sp2017-details.htm?c=218
233,Abacus Solutions,71,https://twitter.com/AbacusWeGetIT,,"IT Solutions, IT Services, IT Products, Disaster Recovery, Network Performance, Managed Services, Business Continuity, Data Hosting Solutions, Data Center Support, New and Used Servers, Networking Equipment, and Third Party Maintenance",http://www.abacusllc.com/,https://www.linkedin.com/company/abacus-solutions/,http://www.crn.com/sp-500/2017/sp2017-details.htm?c=233
234,Blue Chip Tek,40,https://twitter.com/bluechiptek,,"Systems & Virtualization, Networking, Storage & Backup, and Security",http://www.bluechiptek.com/,https://www.linkedin.com/company/bluechiptek,http://www.crn.com/sp-500/2017/sp2017-details.htm?c=234
235,Sovereign Systems,48,https://twitter.com/SovSystems,,"Cloud Computing, Storage, Automation, Orchestration & Lifecycle Management, Data Protection, Hybrid Cloud, Healthcare IT, Managed Services, IT as a Service, and Cloud Brokerage Services",http://www.sovsystems.com/,https://www.linkedin.com/company/sovereign-systems,http://www.crn.com/sp-500/2017/sp2017-details.htm?c=235
236,Three Wire Systems,95,https://twitter.com/threewiresys,,"Information Assurance, Application Development , NextGen Engagement Platform, Infrastructure & Operations, Human Performance Coaching (VetAdvisor Program), Human Capital Management, Telehealth, Transition Support Services, IT Modernization, and Health IT",http://www.threewiresys.com/,https://www.linkedin.com/company/three-wire-systems,http://www.crn.com/sp-500/2017/sp2017-details.htm?c=236
239,TSA,70,https://twitter.com/TSAincorporated,,"Hybrid IT, Managed Services, Networking, Security, Analytics, and Mobility",http://www.tsa.com/,https://www.linkedin.com/company/technical-&-scientific-application-inc--tsa-,http://www.crn.com/sp-500/2017/sp2017-details.htm?c=239
240,GTS Technology Solutions,81,https://twitter.com/GTS_TechSol,,"IT staffing, IT services and support, customized technology solutions, hardware, software, and rugged, installations",http://www.gts-ts.com/,https://www.linkedin.com/company/gts-technology-solutions,http://www.crn.com/sp-500/2017/sp2017-details.htm?c=240
245,CB Technologies,77,https://twitter.com/cbtechinc,,"Cloud Computing, Infrastructure Management, Big Data, Analytics, Asset Intelligence, Software-Defined IT, High Performance Computing, B2B Solutions, Education Technology, IT Services, and IT Procurement",http://www.cbtechinc.com/,https://www.linkedin.com/company/162920?trk=tyah&trkInfo=clickedVertical%3Acompany%2CclickedEntityId%3A162920%2Cidx%3A2-1-2%2CtarId%3A1485898533390%2Ctas%3Acb%20technolo,http://www.crn.com/sp-500/2017/sp2017-details.htm?c=245
250,Audcomp,25,https://twitter.com/Audcomp,,"Cloud Services, Managed Services, Professional Services, Product Procurement, Green IT, Warranty Services, Virtualization, Networking, LAN/WAN/Wireless Deployment, Consulting, Project Management, and Unified Communications",http://www.audcomp.com/,https://ca.linkedin.com/company/audcomp,http://www.crn.com/sp-500/2017/sp2017-details.htm?c=250
251,Emergent,75,https://twitter.com/Emergent360,,"Value Added Reseller, GSA Schedule Holder, Multiple BPA contract holder, NITACC ECS III Contract Holder, and Open Source Systems Integrator",http://www.emergent360.com/,https://www.linkedin.com/company/emergent-360,http://www.crn.com/sp-500/2017/sp2017-details.htm?c=251
253,Kelser Corporation,50,https://twitter.com/KelserCorp,,"Cybersecurity, Cybersecurity-as-a-Service (CSaaS), Disaster Recovery-as-a-Service (DRaaS), Wireless-as-a-Service (WaaS), Networking-as-a-Service (NaaS), Data Center Modernization, IT Lifecycle Management, Workforce Enablement, Managed Services, Virtualization, and Cloud",http://www.kelsercorp.com/,https://www.linkedin.com/company/kelser-corporation,http://www.crn.com/sp-500/2017/sp2017-details.htm?c=253
255,Trilogy Systems,4,NA,,NA,http://www.trilogysystemsllc.com/,https://www.linkedin.com/company-beta/66344/,http://www.crn.com/sp-500/2017/sp2017-details.htm?c=255
256,Ace Computers,83,NA,,"High Perfomance Computing Clusters, Media Servers, HPC Clustsers, Portable Servers, HPC Workstations, Workstations, Forensic Workstations, Ruggedized Clusters, Desktops, Desktops for Schools, and Desktops for Schools",http://www.acecomputers.com/,http://www.linkedin.com/company/ace-computers,http://www.crn.com/sp-500/2017/sp2017-details.htm?c=256
258,Patriot Technologies,51,https://twitter.com/Patriottech,,"InfoSec Professional Services, Data Center Solutions, Custom Hardware Manufacturing & Logistics, Cyber Security Solutions, and End-User Computing",http://www.patriot-tech.com/,http://www.linkedin.com/company/patriot-technologies,http://www.crn.com/sp-500/2017/sp2017-details.htm?c=258
259,TVAR Solutions,23,https://twitter.com/TVARSolutions,,"Cloud Storage, IT Infrastructure, Data Protection, Business Continuity, Information Assurance, and Computing Infrastructure",http://www.tvarsolutions.com/,https://www.linkedin.com/company/tvar-solutions,http://www.crn.com/sp-500/2017/sp2017-details.htm?c=259
263,TeraMach Technologies,60,https://twitter.com/TeraMachCanada,,"Data Centre, Mobility, Security, Applications, Big Data, Solutions, Cloud, Staffing, and Services",http://www.teramach.com/,https://www.linkedin.com/company/366950?trk=tyah&trkInfo=clickedVertical%3Acompany%2CentityType%3AentityHistoryName%2CclickedEntityId%3Acompany_366950%2Cidx%3A0,http://www.crn.com/sp-500/2017/sp2017-details.htm?c=263
264,Key Information Systems (KeyInfo),88,https://twitter.com/_KeyInfo_,,"Corporate IT infrastructure, Storage solutions, Network management, Server and storage virtualization, High Availability & Disaster Recovery, IT Security, Cloud Computing, and Hybrid Cloud",http://www.keyinfo.com/,http://www.linkedin.com/company/510527?trk=tyah,http://www.crn.com/sp-500/2017/sp2017-details.htm?c=264
266,Northern Micro,41,https://twitter.com/NorthernMicro,,"IT Infrastructure, Converged Infrastructure, Networking, Data Storage, Computing Devices, and Deployment Services",http://www.northernmicro.com/,https://www.linkedin.com/company/northern-micro,http://www.crn.com/sp-500/2017/sp2017-details.htm?c=266
270,Business IT Source,28,https://twitter.com/BusITSource,,NA,http://www.bitsinc.com/,http://www.linkedin.com/company/business-it-source,http://www.crn.com/sp-500/2017/sp2017-details.htm?c=270
274,Razor Technology,49,https://twitter.com/_RazorTech,,"Enterprise Infrastructure, Virtual Infrastructure, Cloud Services, Managed Services, Storage Solutions, Backup/Recovery Solutions, Big Data Solutions, Disaster Recovery, High Performance Technical Computing, Data Security & Network Protection, IT Consulting, IaaS, security, Data Center, and Office 365",http://www.razor-tech.com/,https://www.linkedin.com/company/razor-technology/,http://www.crn.com/sp-500/2017/sp2017-details.htm?c=274
277,"Integrated Media Technologies, Inc. (IMT)",61,https://twitter.com/imtglobalinc,,"Systems Integration, IT Services, and Video Collaboration",http://www.imtglobalinc.com/,https://www.linkedin.com/company/integrated-media-technologies/,http://www.crn.com/sp-500/2017/sp2017-details.htm?c=277
278,Red Sky Solutions,66,https://twitter.com/redskysol,,"Networking, Networking Hardware, Networking Services, Cloud, Integration, Security, IT, Infrastructure, Risk Assessment, Storage, Virtualization, Cybersecurity, and IT Security",http://www.redskysol.com,https://www.linkedin.com/company/1119370,http://www.crn.com/sp-500/2017/sp2017-details.htm?c=278
281,n2Grate,24,https://twitter.com/n2grate,,"Data Center Integration, Coud Readiness and Implementation Services, Storage, Network and Virtualization Solutions, and Coud Services Resale",http://www.n2grate.com,https://www.linkedin.com/company/n2grate-government-technology-solutions,http://www.crn.com/sp-500/2017/sp2017-details.htm?c=281
282,cStor,51,https://twitter.com/cStorDataCenter,,"Data Center & Storage, Intelligent Video Surveillance, Cloud & Automation, Information Security, Converged Infrastructure, Virtual Desktop Infrastructure, Data Management / Data Protection, Enterprise Mobility, and Virtualization",http://www.cstor.com/,https://www.linkedin.com/company/cstor,http://www.crn.com/sp-500/2017/sp2017-details.htm?c=282
286,Aspire Technology Partners,75,https://twitter.com/AspireTrans4ms,,"Unified Communications & Collaboration, Information Security, Data Center & Virtualization, Mobility & Wireless, Network Infrastructure, and Digital Transformation",http://www.aspiretransforms.com/,https://www.linkedin.com/company/aspire-technology-partners,http://www.crn.com/sp-500/2017/sp2017-details.htm?c=286
288,"High Availability Storage Systems, Inc.",70,https://twitter.com/HAIncorporated,,"Backup and Recovery, Business Continuity, Virtualization and Primary Storage, Security Compliance, Health Checks and Assessments, and Migrations and Installations",http://www.hainc.com/,https://www.linkedin.com/company/high-availability-inc,http://www.crn.com/sp-500/2017/sp2017-details.htm?c=288
291,Clearpath Solutions Group,60,https://twitter.com/ClearpathSG,,"Storage, Server Virtualization, and Desktop Virtualization",http://www.clearpathsg.com/,https://www.linkedin.com/company/clearpath-solutions-group,http://www.crn.com/sp-500/2017/sp2017-details.htm?c=291
292,Sehi Computer Products,39,https://twitter.com/Sehi_Computer,,"Hardware/Software Procurement, Field Engineering, Educational Contract Pricing, and Technology Integration",http://www.sehi.com/,http://linkedin.com/company/sehi-computer-products,http://www.crn.com/sp-500/2017/sp2017-details.htm?c=292
295,PEAK Resources,86,https://twitter.com/PEAK_Resources,,"IT Consulting and Services, IT Optimization, Cloud-based Solutions, Logistical Support, and Networking Solutions",http://www.peakresources.com/,http://www.linkedin.com/company/peak-resources,http://www.crn.com/sp-500/2017/sp2017-details.htm?c=295
297,Sword & Shield Enterprise Security,86,https://twitter.com/SwordShieldSec,,"Vulnerability Assessment and Penetration Testing, Risk Assessments, Managed Security Service, PCI DSS Compliance Assessments, Incident Response, E-Discovery Consulting, Expert Training, HIPAA Compliance, Computer Forensics, and Application Security Assessments",http://www.swordshield.com/,https://www.linkedin.com/company/235839,http://www.crn.com/sp-500/2017/sp2017-details.htm?c=297
298,Attronica Computers,44,NA,,NA,http://www.attronica.com/,https://www.linkedin.com/company/attronica/,http://www.crn.com/sp-500/2017/sp2017-details.htm?c=298
301,Axispoint,61,https://twitter.com/axispoint,,"Custom Application Development, Technology Consulting, Enterprise Development, Mobile Application Development, Cloud Solutions, Web Development, and Media Asset Management",http://www.axispoint.com,https://www.linkedin.com/company/axispoint/,http://www.crn.com/sp-500/2017/sp2017-details.htm?c=301
304,Quest Solution,76,https://twitter.com/QuestSolution94,,"Mobile Computing, Application Software, Integration, and Barcode, RFID and Wireless Technologies",http://www.questsolution.com/,https://www.linkedin.com/company/106725?trk=tyah&trkInfo=idx%3A2-1-7%2CtarId%3A1424373149325%2Ctas%3Aquest+solution,http://www.crn.com/sp-500/2017/sp2017-details.htm?c=304
305,Derive Technologies,68,https://twitter.com/DeriveTech%20&%20@%20DeriveHealth,,"Cloud Computing, Hyperconverged and Composable Infrastructure, Virtualization, Enterprise Software, Networking, Security and Cyberdefense, End User Devices, Storage and Backup, Healthcare Technology, Government, Financial Services, Professional Services, Hybrid IT, and Configuration and Staging Services",http://www.derivetech.com/,https://www.linkedin.com/company-beta/51563/,http://www.crn.com/sp-500/2017/sp2017-details.htm?c=305
306,Melillo Consulting,95,https://twitter.com/MelilloConsltng,,"Inftastructure & Digital Transformation, IT Operations Management, Disaster Recovery, Software Defined Data Center, Project & Portfolio Management, Mobility & Security, Storage & Data Protection, Big Data Analytics, Operational Intelligence, and HP Software Support",http://www.melillo.com/,http://www.linkedin.com/company/melillo-consulting,http://www.crn.com/sp-500/2017/sp2017-details.htm?c=306
310,BCM One,89,https://twitter.com/bcm_one,,"Telecom Expense Optimization, Microsoft Gold Partner -- MS Office 365, Cloud Solutions, SD WAN, Unified Communications, Managed Services, Microsoft Office 365 Deployments, Network Monitoring & Management, MPLS, Cloud Optimization, Skype for Business Deployments, and Cloud Optimization",http://www.bcmone.com/,http://www.linkedin.com/company/business-communications-management?trk=extra_biz_viewers_viewed,http://www.crn.com/sp-500/2017/sp2017-details.htm?c=310
313,Siwel Consulting,93,https://twitter.com/siwelconsulting,,"Virtualization, Storage, Software Asset Management, IT Staffing Services, IT Asset Management, Data Management, IT Consulting, Software Audits, Software License Audits, IT Help Desk Agent Staffing, IT Help Desk Agent Management, and IT Staff Augmentation",http://www.siwel.com/,https://www.linkedin.com/company/siwel-consulting,http://www.crn.com/sp-500/2017/sp2017-details.htm?c=313
317,Ednetics,97,NA,,NA,http://www.ednetics.com,https://www.linkedin.com/company/136165/,http://www.crn.com/sp-500/2017/sp2017-details.htm?c=317
318,Virtual Graffiti,46,https://twitter.com/virtualgraffiti,,"Network Security, Email Security, Authentication, Endpoint Security, Power & Cooling, Network Management, Vulnerability Management, Storage & Backup, Bandwidth Management, Cloud Computing, Wireless, Virtualization, Encryption, Secure Remote Access, VoIP, and Mobility",http://www.virtualgraffiti.com/,https://www.linkedin.com/company/virtual-graffiti-inc,http://www.crn.com/sp-500/2017/sp2017-details.htm?c=318
319,Decisive Technologies,27,https://twitter.com/Decisivetechno,,"Data Management, Consolidated Storage, Security, Storage Area Network (SAN), Virtualization and Consolidation, Disaster Recovery, Network Security, and Data Migration",http://www.decisive.ca/,https://ca.linkedin.com/company/decisive-technologies,http://www.crn.com/sp-500/2017/sp2017-details.htm?c=319
320,PacStar,74,https://twitter.com/pacstarcomm,,"Tactical Communications Systems, LAN and WAN Technologies, IQ-Core Network Management Software, Unified Communications, Secure Networking Technologies, and Secure WiFi Technologies",http://www.pacstar.com/,https://www.linkedin.com/company/pacific-star-communications,http://www.crn.com/sp-500/2017/sp2017-details.htm?c=320
322,"Business Communications, Inc. (BCI)",63,NA,,"Cloud Services, Data Center, Virtualization, Wireless, Security, Structured Cabling, and Unified Communications",http://www.bcianswers.com/,https://www.linkedin.com/company/business-communications-inc./,http://www.crn.com/sp-500/2017/sp2017-details.htm?c=322
324,Arraya Solutions,86,https://twitter.com/ArrayaSolutions,,"Network Infrastructure Consulting, Application Development, Managed Services, Data Center, Cloud Services, Project Management, and Cyber Security",http://www.arrayasolutions.com/,https://www.linkedin.com/company/arraya-solutions,http://www.crn.com/sp-500/2017/sp2017-details.htm?c=324
325,Global Business Dimensions,19,NA,,NA,http://www.globalbd.com/,https://www.linkedin.com/company-beta/82040/,http://www.crn.com/sp-500/2017/sp2017-details.htm?c=325
329,"CCT Technologies, Inc.",70,https://twitter.com/ComputerLandSV,,"Cloud, Mobility & Wireless, Unified Communications, Network Infrastructure, Virtualization, Security, Storage, IT Relocation, Managed Services, and Software Licensing",http://www.cland.com/,https://www.linkedin.com/company/cland,http://www.crn.com/sp-500/2017/sp2017-details.htm?c=329
331,Solutions II,71,https://twitter.com/Solutionsii,,"Business Continuance and Disaster Recovery, Virtualization, Storage Optimization, Professional IT Services, Network Security, and Information Security",http://www.solutions-ii.com/,https://www.linkedin.com/company/61048,http://www.crn.com/sp-500/2017/sp2017-details.htm?c=331
