Rank,Name,Employee Count,Twitter,Potential Partner,Services,Website,LinkedIn,CRN Page
332,vCORE Technology Partners,67,https://twitter.com/vCOREtec,,"IT Infrastructure Optimization, Data Center Strategies, Managed Services, Data Analytics, Cyber-security, Hybrid Cloud, and Data Protection",http://www.vcoretec.com/,https://www.linkedin.com/company/vcore-technology-partners,http://www.crn.com/sp-500/2017/sp2017-details.htm?c=332
333,TechXtend,18,https://twitter.com/techxtend,,"Cloud computing/virtualization, Storage and data management, Business intelligence/information management, Developer and database tools, Servers, workstations, storage, networking, printers, Business Productivity, and Software license mining & management",http://www.techxtend.com/,https://www.linkedin.com/company/techxtend,http://www.crn.com/sp-500/2017/sp2017-details.htm?c=333
334,Daymark Solutions,50,https://twitter.com/DaymarkSI,,"IT Professional Services, IT Integration, Data Center Infrastructure, Data Protection, Virtualization, Cloud Solutions, Managed Services, EMC, NetApp, Veritas, VMWare, and Cisco",http://www.daymarksi.com/,https://www.linkedin.com/company/daymark-solutions-inc.,http://www.crn.com/sp-500/2017/sp2017-details.htm?c=334
335,Information Transport Solutions,72,NA,,NA,http://www.its-networks.com/,https://www.linkedin.com/company-beta/144551/,http://www.crn.com/sp-500/2017/sp2017-details.htm?c=335
339,Critical Start,55,https://twitter.com/criticalstart,,"Network Security Consulting Services, Incident Response, GRC, Risk and Compliance, DLP, Threat Management, Malware, and Managed Services",http://www.criticalstart.com,https://www.linkedin.com/company/critical-start,http://www.crn.com/sp-500/2017/sp2017-details.htm?c=339
340,BCDVideo,44,https://twitter.com/BCDVideo,,"IP Video Surveillance Servers & Storage, Harsh Environment Servers, Client Video Workstations, Commercial Grade Monitors, Direct-Attached, iSCSI, SAN Storage, Video Appliances, Access Control Servers, and Value-Engineered Networking Solutions",http://www.bcdvideo.com,https://www.linkedin.com/company/2570446/,http://www.crn.com/sp-500/2017/sp2017-details.htm?c=340
342,Achieve 1,19,https://twitter.com/Achieve1_VA,,"Data Center Design, Virtual Desktop, Data Backup/Recovery, and IT Partnering & Consulting",http://www.achieve-1.com/,https://www.linkedin.com/company/achieve-1,http://www.crn.com/sp-500/2017/sp2017-details.htm?c=342
343,The Pinnacle Group,20,https://twitter.com/TPGTotalIT,,"IBM Premier Business Partner, HP Platinum Partner, Cisco Select Partner, and Dell Partner Direct Premier",http://www.thepinnaclegroup.com/,http://www.linkedin.com/company/the-pinnacle-group-companies,http://www.crn.com/sp-500/2017/sp2017-details.htm?c=343
344,Möbius Partners,51,https://twitter.com/MobiusPartners,,"Data Center, Professional Services, IT, Service delivery, Virtualization, Support Management, Automation, online procurement, Networking, Cloud, Software Defined, Security, Big Data, Operational Excellence, Cloud Integration, Infrastructure Management, DevOps, Converged, Hybrid IT, and Data Center Transformation",http://www.mobiuspartners.com/,https://www.linkedin.com/company/83313,http://www.crn.com/sp-500/2017/sp2017-details.htm?c=344
347,"M&S Technologies, A Kudelski Security Company",46,https://twitter.com/mandstech,,"Managed security services and solutions, security incident response, threat monitoring, risk assessment and compliance, penetration testing, device security evaluation, identity and access management, security compliance training, and cyber legal support.",http://www.mandstech.com/,https://www.linkedin.com/company/m&s-technologies/,http://www.crn.com/sp-500/2017/sp2017-details.htm?c=347
348,Vantage Point Corporation (VPC),73,https://twitter.com/VPCinnovations,,"Tech Hardware Products, Software Sales, and Entertainment Technology",http://www.vpcinnovations.com/,https://www.linkedin.com/company/vantage-point-corporation---buyvpc,http://www.crn.com/sp-500/2017/sp2017-details.htm?c=348
349,Accucode,99,https://twitter.com/accucode,,"IT, AIDC, SaaS, HaaS, PaaS, Bar Code Solutions, Managed Services, LifeCycle Support, VAR, Hardware, Software, Professional Services, WMS, Mail Tracking, Retail Automation, Warehouse Management, Inventory Management, Google Apps, Network Infrastructure, and RFID",http://www.accucode.com/,https://www.linkedin.com/company/accucode,http://www.crn.com/sp-500/2017/sp2017-details.htm?c=349
350,CorpInfo,55,https://twitter.com/CorpInfo,,"IT Consulting, Amazon Web Services, Cloud Computing, Big Data, DevOps, Managed Services, Migration Services, and Security & Compliance",http://www.corpinfo.com/,https://www.linkedin.com/company/25236/,http://www.crn.com/sp-500/2017/sp2017-details.htm?c=350
352,DZ Solutions,63,https://twitter.com/DZSolutions,,"Networking, Support, Integration, Development, Virtualization, and Storage",http://www.dzsolutions.com/,https://www.linkedin.com/company/dz-solutions/,http://www.crn.com/sp-500/2017/sp2017-details.htm?c=352
353,Now Micro,41,https://twitter.com/nowmicro,,"Digital Signage, Hardware Sales (desktop/laptop/server/printer/etc), Microsoft Solution Support, Microsoft Embedded Design Services, Microsoft Consulting Services, System Center Configuration Manager, Technology Refresh, and Virtualization",http://www.nowmicro.com,https://www.linkedin.com/company/now-micro,http://www.crn.com/sp-500/2017/sp2017-details.htm?c=353
358,Allied Network Solutions (ANS),25,NA,,Professional Services and Computer Hardware and Software Value Added Reseller,http://www.ans-it.com/,https://www.linkedin.com/company/110340?trk=prof-0-ovw-curr_pos,http://www.crn.com/sp-500/2017/sp2017-details.htm?c=358
359,Nth Generation Computing,76,https://twitter.com/2theNTH,,"IT Business Strategy, Data/Information Mgmt, Converged Infrastructure, Data Center Mgmt, IT Virtualization, Cloud Computing, Business Automation, Risk Management & Enterprise Security, Modern Application Lifecycle Mgmt, Data Center Transformation, and Project Management",http://www.nth.com/,http://www.linkedin.com/company/nth-generation-computing,http://www.crn.com/sp-500/2017/sp2017-details.htm?c=359
361,Stoneworks Technologies (SWTI),20,https://twitter.com/SWTIca,,"Cloud Computing, DataCenter, Virtualization, Big Data, Security, Software, Mobility, and Professional Services",http://www.swti.ca/,https://www.linkedin.com/company/9034363?trk=tyah&trkInfo=clickedVertical%3Acompany%2CclickedEntityId%3A9034363%2Cidx%3A1-1-1%2CtarId%3A1443193616094%2Ctas%3Astoneworks%20tech,http://www.crn.com/sp-500/2017/sp2017-details.htm?c=361
363,CTL,49,https://twitter.com/ctlcorp,,"Education Solutions, 1:1 Deployments, Chrome Products and Services, Display Solutions, Windows and Android Integration, Professional Development, Computer Systems, Cloud based software, G Suite, and GCP and AWS",http://www.ctl.net/,https://www.linkedin.com/company/520794/,http://www.crn.com/sp-500/2017/sp2017-details.htm?c=363
364,World Data Products (WDPI),73,https://twitter.com/WDPI,,"New and refurbished servers, storage and networking hardware, Maximizing your IT budget without sacrificing quality & reliability, Parts repair, IT hardware maintenance, Buying used servers, storage, and networking hardware, Data Migration, Data Destruction, Certified Computer Tape, Networking, IT Consulting, IT Hardware Buyback, Used Servers, Used Networking Equipment, Tape Library Services, Tape Audits, Custom Server Configuration, Refurbished Servers, Refurbished Networking, IT Asset Disposition, and ITAD",http://www.wdpi.com/,https://www.linkedin.com/company/world-data-products,http://www.crn.com/sp-500/2017/sp2017-details.htm?c=364
366,Universal E-Business Solutions,62,https://twitter.com/uebiz,,"Low-latency networks, Financial Markets, Extranets, Exchanges, Data Center, Virtualization, Unified Communications, Unified Computing, Network Security, Wireless LAN, Managed Services, Project Management, and Process Management",http://www.uebiz.com/,https://www.linkedin.com/company/universal-e-business-solutions,http://www.crn.com/sp-500/2017/sp2017-details.htm?c=366
369,CBI,98,https://twitter.com/CBI_IT,,"CBI Security Manager, Digital Forensics, Identity Management, Incident Response, Managed Services, Data Loss Prevention, Pen Testing, Vulnerability Management, Managed SEP, Encryption, Advisory Services, Compliance & Governance, and Social Engineering",http://www.cbihome.com/,http://www.linkedin.com/company/cbisecure,http://www.crn.com/sp-500/2017/sp2017-details.htm?c=369
371,Precision Computer Services (PCS),57,https://twitter.com/pcs_shelton,,"Managed Services, Storage Infrastructure, Collaboration, Virtualization, Networking, Staff Augmentation Services, Cloud Services, and Hyper-Converged Infrastructure",http://www.precisiongroup.com/,http://www.linkedin.com/company/precision-computer-services,http://www.crn.com/sp-500/2017/sp2017-details.htm?c=371
372,IMPEX Technologies,31,https://twitter.com/IMPEXLA,,"Hybrid Cloud, Datacenter Solutions, Virtualization, Data Protection and Disaster Recovery, Converged Infrastructure, Virtualization, Enterprise Storage, and State, Local and Education Markets",http://www.impextechnologies.com/,http://www.linkedin.com/company/impex-technologies-inc?trk=top_nav_home,http://www.crn.com/sp-500/2017/sp2017-details.htm?c=372
375,Future Com,64,https://twitter.com/_FutureCom,,"Network, Professional Services, Consulting, PCI, SOX, and HIPPA",http://www.myfuturecom.com/,https://www.linkedin.com/company/future-com,http://www.crn.com/sp-500/2017/sp2017-details.htm?c=375
377,Netelligent,91,https://twitter.com/Netelligent,,"Hosted Collaboration Solutions (HCS), Help Desk, Infrastructure as a Service (IaaS), Monitoring as a Service (NetTend), Desktop as a Service (DaaS), Hybrid IT, Backup as a Service (BaaS), Managed Security, Cloud Services, and Disaster Recovery as a Service (DRaaS)",http://www.netelligent.com/,https://www.linkedin.com/company/netelligent-corporation,http://www.crn.com/sp-500/2017/sp2017-details.htm?c=377
378,EVOTEK,64,https://twitter.com/EVOTEKtweets,,"Data Center Technologies, Enterprise Storage, Virtualization, Network, Security, Data Protection, and Analytics",http://www.evotek.com/,https://www.linkedin.com/company/evotek,http://www.crn.com/sp-500/2017/sp2017-details.htm?c=378
379,Comport Technology Solutions,50,https://twitter.com/ComportConsult,,"HPE Enterprise Server, Healthcare Medical Image Archiving, Converged Infrastructure, Virtualization, Storage Solutions, Networking, Managed Services, Cloud, Backup and Recovery, and Data Protection & Security",http://www.comport.com/,http://www.linkedin.com/company/comport-consulting,http://www.crn.com/sp-500/2017/sp2017-details.htm?c=379
380,Epic - A Bell MTS Company,72,https://twitter.com/EpicTalks,,"Managed Services Solutions, Virtualization, Servers and Storage, Infrastructure Solutions, Web Development and Design, Print Solutions, Database Configuration, Cloud Hosted Services, Epic Tech Day - Bi-Annual IT Conference, and and much more...",http://www.epic.ca/,https://www.linkedin.com/company/epic-information-solutions,http://www.crn.com/sp-500/2017/sp2017-details.htm?c=380
381,High Point Networks,97,https://twitter.com/HiPoNetworks,,"Networking/Switching/Routing, VoIP and Unified Communications, Network Security, Storage Consolidation and Virutalization, Video Surveillance, Servers/Workstations/Peripherals, and Professional Services",http://www.highpointnetworks.com/,http://www.linkedin.com/company/1350297,http://www.crn.com/sp-500/2017/sp2017-details.htm?c=381
382,Focus Technology Solutions,53,https://twitter.com/FocusTSI,,"Cloud Compution, VDI Solutions (Virtual Desktop Infrastructure), Virtualization, Data Center, and Managed Services",http://www.focustsi.com/,https://www.linkedin.com/company/focus-technology-solutions,http://www.crn.com/sp-500/2017/sp2017-details.htm?c=382
386,Open Storage Solutions,45,https://twitter.com/openstoredotcom,,NA,http://www.openstore.com/,https://www.linkedin.com/company/open-storage-solutions/,http://www.crn.com/sp-500/2017/sp2017-details.htm?c=386
388,Sanity Solutions,44,https://twitter.com/sanitysolutions,,"Business Continuity, Disaster Recovery, Backup and Recovery, Data Security, Infrastructure, Secondary Storage, Primary Storage, and OpenStack",http://www.sanitysolutions.com/,http://www.linkedin.com/company/sanity-solutions,http://www.crn.com/sp-500/2017/sp2017-details.htm?c=388
390,"Eastern Data, Inc. (EDI)",23,https://twitter.com/ediatlanta,,"Network Administration, Virtualization Technologies, Server Maintenance, Data Backup and Storage Solutions, Managed Service Agreements, End-User Helpdesk Support, IT and Medical Practice Consulting, Managed Cloud Services, and HIPAA Security Compliance",http://ediatlanta.com/,https://www.linkedin.com/company/eastern-data-inc./,http://www.crn.com/sp-500/2017/sp2017-details.htm?c=390
392,Aqueduct Technologies,69,https://twitter.com/AqueductTech,,"Collaboration, Data Center, Cloud, Managed Services, Enterprise Networking, Professional Services, Product Resale, Hybrid Cloud Solutions, Advanced Security, Conferencing & Messaging, Cloud Security, Identity Services, Adoption Services, and Behavioral Anomaly Detection",http://www.aqueducttech.com/,http://www.linkedin.com/company/aqueduct-technologies,http://www.crn.com/sp-500/2017/sp2017-details.htm?c=392
393,Edge Solutions,31,https://twitter.com/designyouredge,,"Data center management, server and storage virtualization, storage management, data protection information management, and asset and services contract management",http://www.edge-solutions.com/,https://www.linkedin.com/company/edge-solutions-llc,http://www.crn.com/sp-500/2017/sp2017-details.htm?c=393
397,Axispoint Technology Solutions Group,50,https://twitter.com/TeamATSG,,NA,http://www.atsg.net/,https://www.linkedin.com/company/axispoint-technology-solutions-group/,http://www.crn.com/sp-500/2017/sp2017-details.htm?c=397
398,MCW Solutions,82,https://twitter.com/mcw_solutions,,"Electronic Security & Surveillance, Audiovisual, Network & Teledata, Managed IT Services, and Cybersecurity",http://www.mcwsolutions.com/,https://www.linkedin.com/company/582276,http://www.crn.com/sp-500/2017/sp2017-details.htm?c=398
401,En-Net Services,32,NA,,NA,http://www.en-netservices.com/,https://www.linkedin.com/company/en-net-services/,http://www.crn.com/sp-500/2017/sp2017-details.htm?c=401
403,PCNation,41,https://twitter.com/pcnation,,"IT Sales, Software Sales, Digital Photography Sales, and New Store Just Opened! Come Visit us!!!",http://www.pcnation.com/,https://www.linkedin.com/company/83984/,http://www.crn.com/sp-500/2017/sp2017-details.htm?c=403
405,RightStar Systems,71,https://twitter.com/rightstartweets,,"IT Service Management Consulting, Design, and Implementation, DevOps and ALM Consulting and Advisory Services, ITIL Process Consulting and Training, Full lines of BMC Software and Atlasssian products, Automation of IT Processes, and IT Operations Monitoring",http://www.rightstar.com/,http://www.linkedin.com/company/rightstar-systems,http://www.crn.com/sp-500/2017/sp2017-details.htm?c=405
406,FedBiz IT Solutions,8,https://twitter.com/FedBizIT,,"Cyber-Security and Network Solutions, Enterprise Storage services and products, Information Technology services and products, and Capture and Proposal Consulting Services",http://www.fedbizit.com/,http://www.linkedin.com/company/3154712?trk=tyah,http://www.crn.com/sp-500/2017/sp2017-details.htm?c=406
407,DH Technologies,41,https://twitter.com/dh_tech,,"Virtualization, Security Compliance, Virtual Desktops, Disaster Recovery, Data Center Consolidation, and Backup",http://www.dhtech.com/,https://www.linkedin.com/company/3099801,http://www.crn.com/sp-500/2017/sp2017-details.htm?c=407
408,ITS Partners,93,https://twitter.com/its_partners,,"Symantec Security (DLP, CSP, SEP, ATP), Managed Services, Support, Microsoft System Center, ServiceNow, Productive IT, IT Process Automation, IT Risk Management, IT Asset Management, IT Systems Management, IT Service Management, Windows 10, and Office 365",http://www.itsdelivers.com/,https://www.linkedin.com/company/its-partners,http://www.crn.com/sp-500/2017/sp2017-details.htm?c=408
411,NOVIPRO,91,https://twitter.com/NOVIPRO,,"Systeme Z, Virtualisation des bureaux de travail (VDI), Mobilite, Gestion des données, Solutions ERP, Transformation des TI et le Cloud, and Services professionnels",http://www.novipro.com/,http://www.linkedin.com/companies/novipro,http://www.crn.com/sp-500/2017/sp2017-details.htm?c=411
412,PKA Technologies,31,https://twitter.com/pkatech,,"Hewlett Packard Enterprise Platinum Partner, Hewlett Packard Public Sector Specialist, Hewlett Packard ServiceONE Expert, Red Hat Advanced Business Partner, NYS NYC and SNJ Certified WBE, and WBENC National Certified WBE",http://www.pkatech.com/,http://www.linkedin.com/company/231496,http://www.crn.com/sp-500/2017/sp2017-details.htm?c=412
413,HighVail Systems,29,https://twitter.com/highvail,,"Open Source Software, Converged Infrastructure & Virtualization, Cloud & Data Center Infrastructure, Backup, Archiving & e-Discovery, High Availability & Business Continuity, File & Content Solutions, Server & Storage Solutions, and Oracle Software and Hardware",http://www.highvail.com/,https://www.linkedin.com/company/559716,http://www.crn.com/sp-500/2017/sp2017-details.htm?c=413
414,TERACAI,42,https://twitter.com/teracai,,"Cisco Silver Partner, Cisco Network Hardware, Cisco SMARTnet, Cisco Security, Cisco Wireless, Cisco Unified Communications, Cisco Switches, Cisco Routers, Network Hardware, Cisco, Network Cabling, Data Center Solutions, Cloud Services, Managed Services, and Virtualization",http://www.teracai.com/,https://www.linkedin.com/company/teracai-corporation,http://www.crn.com/sp-500/2017/sp2017-details.htm?c=414
415,Central Computers,4,https://twitter.com/centralcomputer,,NA,http://www.centralcomputers.com/,https://www.linkedin.com/company-beta/3892908/,http://www.crn.com/sp-500/2017/sp2017-details.htm?c=415
419,F3 Technology Partners,29,https://twitter.com/f3partners,,"Virtualization, Systems, Storage Solutions, Oracle Database, Security Services, Cloud Computing, Data Center Modernization, Data Protection, Cloud Architecture, and Remote Managed Services",http://www.f3partners.com/,http://www.linkedin.com/company/311253?trk=tyah,http://www.crn.com/sp-500/2017/sp2017-details.htm?c=419
420,Vintage IT Services,23,https://twitter.com/VintageITS,,"Managed IT Services, Cloud Computing, IT Security Service, Award Winning IT Services Company, Backup Solutions, Disaster Recovery, Desktop As A Service, Hosted Exchange, Spam Filter, Network Monitoring and Maintenance , and Excellent Customer Service",http://www.vintageits.com/,https://www.linkedin.com/company/vintage-it-services/,http://www.crn.com/sp-500/2017/sp2017-details.htm?c=420
421,Adapture,22,https://twitter.com/ADAPTURETech,,NA,http://www.adapture.com/,https://www.linkedin.com/company/adapture,http://www.crn.com/sp-500/2017/sp2017-details.htm?c=421
422,Plan B Technologies,61,https://twitter.com/PlanBTech,,"Storage Area Networking, Backup, Recovery & Archiving, Microsoft Solutions, Virtualization, Cloud Computing, Networking, Security Services, Data Management, and Threat Protection",http://www.planbtech.net/,http://www.linkedin.com/company/plan-b-technologies,http://www.crn.com/sp-500/2017/sp2017-details.htm?c=422
426,Compulink Technologies,13,https://twitter.com/CompulinkTech,,"Systems Integration, Networking, and Maitenance, Hardware & Software Procurement, Telecom Infrastructure, Managed Service, Certifications: Hp, Cisco, EMC, Citrix, Dell, Lenovo, Symantec, VMware, Juniper Networks, SonicWall, Riverbed, and and many more",http://www.compu-link.com/,https://www.linkedin.com/company/2331479,http://www.crn.com/sp-500/2017/sp2017-details.htm?c=426
428,Brite Computers,55,https://twitter.com/BriteComputers,,"Data Network Security, Managed IT Services, Business-to-Business, Public Safety, Healthcare, Higher Education, ForeScout, Vigilant, CheckPoint, Cylance, McAfee, CyberArk, Fujitsu, and Lenovo",http://www.britecomputers.com/,http://www.linkedin.com/company/brite-computers,http://www.crn.com/sp-500/2017/sp2017-details.htm?c=428
429,Pinnacle Business Systems,76,https://twitter.com/PinnacleNOW,,"Big Data and Advanced Solutions, Cloud Solutions, Data Protection & Disaster Recovery, Networking Solutions, Virtualization Solutions, Information Security, Unified Communications, and Solutions for IBM System 1",http://www.pbsnow.com/,http://www.linkedin.com/company/pinnacle-business-systems,http://www.crn.com/sp-500/2017/sp2017-details.htm?c=429
430,Unistar-Sparco Computers,49,https://twitter.com/UnistarSparco,,"IT Professional Services, Program Management, Data Center Efficiency, Integration & Customization Center, Data Center Consolidation, Government Contracting, Application Development, Storage Security, Federal Gov IT, State & Local Gov IT, and IT Life Cycle",http://www.sparco.com/,https://www.linkedin.com/company/unistar-sparco-computers-inc.,http://www.crn.com/sp-500/2017/sp2017-details.htm?c=430
432,Zumasys,84,https://twitter.com/zumasys,,"Cloud Computing, IT Infrastructure Solutions, Desktop as a Service, Desktop Virtualization, Infrastructure as a Service, Software Development, Disaster Recovery, Application Hosting, Network Security, DaaS, IaaS, MultiValue, Pick, D3, jBASE, U2, UniVerse, UniData, Server Virtualization, Office365, Veeam, VMware, Microsoft, Nimble Storage, and Citrix",http://www.zumasys.com/,https://www.linkedin.com/company-beta/97198/,http://www.crn.com/sp-500/2017/sp2017-details.htm?c=432
433,Mirapath,61,https://twitter.com/mirapath,,"Datacenter and Lab Infrstructure Solutions, Low Voltage Structured Cabling, Management Platform, Managed Services, Lab Automation, Moves & Migrations, Racks, Power, Connectivity, Power Management & Energy Efficiency, and UPS and Cooling/Containment",http://www.mirapath.com/,https://www.linkedin.com/company/mirapath,http://www.crn.com/sp-500/2017/sp2017-details.htm?c=433
434,Paradigm Technology,86,https://twitter.com/paradigm_tech_,,"Cloud, Big Data, Project Management, Professional Services, Analytics, Business Analysis, Infrastructure, Application Integration, Managed Services, Consulting, Project Portfolio Management, Hybrid Cloud, Master Data Management, Data Quality, Strategy, and Governance",http://www.pt-corp.com/,http://www.linkedin.com/company/paradigm-technology,http://www.crn.com/sp-500/2017/sp2017-details.htm?c=434
436,American Digital Corporation,41,https://twitter.com/AmDigitalCorp,,"IT Infrastructure Consulting / Professional Services, Enterprise Servers, Storage, Networking & Software, Security Solutions- Threat & Risk Assessments, Cloud Solutions- Private or Hybrid, Managed Services, and Wireless Mobility",http://www.americandigital.com/,https://www.linkedin.com/company/87501?trk=tyah&trkInfo=idx%3A2-1-4%2CtarId%3A1424804824666%2Ctas%3Aamerican+digital,http://www.crn.com/sp-500/2017/sp2017-details.htm?c=436
438,HCGI,49,https://twitter.com/HCGI_com,,HP Premier Partner,http://www.hcgi.com/,https://www.linkedin.com/company/hartford-computer-group/,http://www.crn.com/sp-500/2017/sp2017-details.htm?c=438
439,Ideal System Solutions,33,https://twitter.com/idealssi,,"IT Solutions, Enterprise Solutions, Professional Services, Managed Services, Help Desk, Product Procurement, Unified Communications, Voice, Video, Data, Staff Augmentation, Professional Placement, and Benefit & Payroll Services",http://www.idealssi.com/,http://www.linkedin.com/company/554934,http://www.crn.com/sp-500/2017/sp2017-details.htm?c=439
441,GANTECH,90,https://twitter.com/GANTECHinc,,"Virtualization, Managed Services, End-User Computing (EUC), Virtual Desktop Infrastructure (VDI), Desktop-as-a-Service, Data Center Transformation, ITIL, VMware Technologies, Systems Integration, Networking, Managed EUC, Computing, and Security",http://www.gantech.net/,http://www.linkedin.com/company/1566974,http://www.crn.com/sp-500/2017/sp2017-details.htm?c=441
442,Winslow Technology Group,42,https://twitter.com/winslowtg,,"Data Management - CommVault, Quest, Veeam, Server and Desktop Virtualization - VMware ESXi and View, and SAN/NAS Storage - Compellent, EqualLogic, PowerVault, Nexsan, Isilon",http://www.winslowtg.com/,https://www.linkedin.com/company/winslow-technology-group,http://www.crn.com/sp-500/2017/sp2017-details.htm?c=442
444,Kinney Group,79,https://twitter.com/kinneygroup,,"Network Storage and Computing, Public, Private, and Hybrid Clouds, Virtualized Infrastructure, Automation and Orchestration, Configuration Management, Networking and Security, Next Generation Data Centers, and Data Analytics",http://www.kinneygroup.com/,http://www.linkedin.com/company/kinney-group-inc-,http://www.crn.com/sp-500/2017/sp2017-details.htm?c=444
445,PCS Mobile,33,NA,,"Mobility Solutions for data, In-Building Communication Systems, Computer Hardware, License Plate Recognition, and Parking & Transportation",http://www.pcsmobile.com/,https://www.linkedin.com/company/pcs-mobile,http://www.crn.com/sp-500/2017/sp2017-details.htm?c=445
447,BlueBridge Networks,13,https://twitter.com/BlueBridgeLLC,,"Data Center Collocation, Virtualization, Managed Services, Data Center Optimization, Cloud, DR/BC, Infrastructure Solutions, Workgroup Recovery, Managed Storage, and Managed Security",http://www.bluebridgenetworks.com/,http://www.linkedin.com/company/140169,http://www.crn.com/sp-500/2017/sp2017-details.htm?c=447
